{
  "schemaVersion": 1,
  "snapshotId": "google-play-in-games-top-paid-all-games-20261001T013518591Z",
  "store": "google-play",
  "market": "IN",
  "scope": "games",
  "chart": "top-paid",
  "normalizedCategory": "all-games",
  "storeCategory": "GAME",
  "capturedAt": "2026-10-01T01:35:18.591Z",
  "observationDate": "2026-10-01",
  "marketTimeZone": "Asia/Kolkata",
  "marketObservationDate": "2026-10-01",
  "status": "partial",
  "expectedCount": 100,
  "actualCount": 57,
  "complete": false,
  "source": {
    "type": "google-play-scraper",
    "method": "list",
    "url": "https://play.google.com/store/games?hl=en&gl=IN",
    "collectorVersion": "0.1.0",
    "adapterVersion": "@mradex77/google-play-scraper@1.3.0",
    "payloadSha256": "da3b0aaa0bc37065a942820e8c45247c74ef092fc6c4c6e84bc0343503e2bb19"
  },
  "validation": {
    "previousSnapshotId": null,
    "flags": [
      "count_below_expected:57/100"
    ]
  },
  "entries": [
    {
      "rank": 1,
      "appId": "com.mojang.minecraftpe"
    },
    {
      "rank": 2,
      "appId": "com.rockstargames.gtasa"
    },
    {
      "rank": 3,
      "appId": "it.rortos.realflightsimulator"
    },
    {
      "rank": 4,
      "appId": "com.squareenixmontreal.hitmansniperandroid"
    },
    {
      "rank": 5,
      "appId": "com.avecreation.drivingzonegermanypro"
    },
    {
      "rank": 6,
      "appId": "com.notdoppler.earntodie"
    },
    {
      "rank": 7,
      "appId": "nz.co.codepoint.minimetro"
    },
    {
      "rank": 8,
      "appId": "com.agaming.thesun.origin"
    },
    {
      "rank": 9,
      "appId": "com.fansipan.stickman.shadow.knights.fightinggames"
    },
    {
      "rank": 10,
      "appId": "com.pgstudio.survival.evo.pro"
    },
    {
      "rank": 11,
      "appId": "com.rockstargames.gtavc"
    },
    {
      "rank": 12,
      "appId": "mobi.bestfreegames.bike.mayhem.extreme.mountain.racing"
    },
    {
      "rank": 13,
      "appId": "com.agaming.zona.shadow.of.limansk.redux"
    },
    {
      "rank": 14,
      "appId": "com.feralinteractive.hitmanabsolution_android"
    },
    {
      "rank": 15,
      "appId": "com.hg.wreckfest"
    },
    {
      "rank": 16,
      "appId": "com.ironhidegames.android.kingdomrush6.genesis"
    },
    {
      "rank": 17,
      "appId": "com.feralinteractive.tombraider_android"
    },
    {
      "rank": 18,
      "appId": "com.rockstar.maxpayne"
    },
    {
      "rank": 19,
      "appId": "com.TwoStarGames.ChooChooCharles"
    },
    {
      "rank": 20,
      "appId": "com.MOBGames.PoppyMobileChap1"
    },
    {
      "rank": 21,
      "appId": "com.pockettrend.neomonsters"
    },
    {
      "rank": 22,
      "appId": "com.nekki.vector.paid"
    },
    {
      "rank": 23,
      "appId": "com.rupee5.app"
    },
    {
      "rank": 24,
      "appId": "com.Zonmob.Stickman.FightingGames.ShadowOfDeath"
    },
    {
      "rank": 25,
      "appId": "com.oxiwyle.modernage3premium"
    },
    {
      "rank": 26,
      "appId": "com.th.cargo.truck.game.sim"
    },
    {
      "rank": 27,
      "appId": "com.agaming.reporter"
    },
    {
      "rank": 28,
      "appId": "com.feralinteractive.gridas"
    },
    {
      "rank": 29,
      "appId": "com.QuanticBit.NeonValley"
    },
    {
      "rank": 30,
      "appId": "com.zigzagame.evertale"
    },
    {
      "rank": 31,
      "appId": "com.fiverupees.app"
    },
    {
      "rank": 32,
      "appId": "com.birrupee.app"
    },
    {
      "rank": 33,
      "appId": "com.rubberbandgames.wobblylifev2"
    },
    {
      "rank": 34,
      "appId": "com.FireproofStudios.TheRoom"
    },
    {
      "rank": 35,
      "appId": "com.ironhidegames.android.kingdomrush.alliance"
    },
    {
      "rank": 36,
      "appId": "com.and.games505.humanfallflat"
    },
    {
      "rank": 37,
      "appId": "com.giantssoftware.fs20.google"
    },
    {
      "rank": 38,
      "appId": "com.playdigious.littlenightmare"
    },
    {
      "rank": 39,
      "appId": "com.playdigious.deadcells.mobile"
    },
    {
      "rank": 40,
      "appId": "com.playstack.balatro.android"
    },
    {
      "rank": 41,
      "appId": "com.chucklefish.stardewvalley"
    },
    {
      "rank": 42,
      "appId": "com.imcrazy.ds2"
    },
    {
      "rank": 43,
      "appId": "com.playdigious.pol"
    },
    {
      "rank": 44,
      "appId": "com.divmob.autochess.heroesinfinity"
    },
    {
      "rank": 45,
      "appId": "com.playdead.limbo.full"
    },
    {
      "rank": 46,
      "appId": "com.xd.tabs.google"
    },
    {
      "rank": 47,
      "appId": "com.unknownworlds.subnautica"
    },
    {
      "rank": 48,
      "appId": "com.pid.caravansandwitch"
    },
    {
      "rank": 49,
      "appId": "com.and.games505.TerrariaPaid"
    },
    {
      "rank": 50,
      "appId": "brownmonster.app.game.rushrally2"
    },
    {
      "rank": 51,
      "appId": "com.noodlecake.gettingoverit"
    },
    {
      "rank": 52,
      "appId": "com.nekki.shadowfight2.paid"
    },
    {
      "rank": 53,
      "appId": "com.fundaygames.scritchyscratchy"
    },
    {
      "rank": 54,
      "appId": "com.coffeestain.goatsimulator3"
    },
    {
      "rank": 55,
      "appId": "com.doghowlgames.EasyDeliveryCo"
    },
    {
      "rank": 56,
      "appId": "com.strayfawnstudio.gambonanza"
    },
    {
      "rank": 57,
      "appId": "com.pid.shotgunking"
    }
  ]
}
