{
  "schemaVersion": 1,
  "snapshotId": "google-play-de-games-top-paid-all-games-20261008T085804559Z",
  "store": "google-play",
  "market": "DE",
  "scope": "games",
  "chart": "top-paid",
  "normalizedCategory": "all-games",
  "storeCategory": "GAME",
  "capturedAt": "2026-10-08T08:58:04.559Z",
  "observationDate": "2026-10-08",
  "marketTimeZone": "Europe/Berlin",
  "marketObservationDate": "2026-10-08",
  "status": "partial",
  "expectedCount": 100,
  "actualCount": 84,
  "complete": false,
  "source": {
    "type": "google-play-scraper",
    "method": "list",
    "url": "https://play.google.com/store/games?hl=en&gl=DE",
    "collectorVersion": "0.1.0",
    "adapterVersion": "@mradex77/google-play-scraper@1.3.0",
    "payloadSha256": "0dca4c82e36ea1e9b0d3d13bfbc3462afe5b0cd4ebe37d85669cde9e4343b47b"
  },
  "validation": {
    "previousSnapshotId": "google-play-de-games-top-paid-all-games-20261005T090432458Z",
    "flags": [
      "count_below_expected:84/100"
    ]
  },
  "entries": [
    {
      "rank": 1,
      "appId": "com.mojang.minecraftpe"
    },
    {
      "rank": 2,
      "appId": "com.batomon.showdown"
    },
    {
      "rank": 3,
      "appId": "com.robtopx.geometryjump"
    },
    {
      "rank": 4,
      "appId": "com.ninjakiwi.bloonstd6"
    },
    {
      "rank": 5,
      "appId": "com.ironhidegames.android.kingdomrush6.genesis"
    },
    {
      "rank": 6,
      "appId": "com.chucklefish.stardewvalley"
    },
    {
      "rank": 7,
      "appId": "com.fundaygames.scritchyscratchy"
    },
    {
      "rank": 8,
      "appId": "com.rubberbandgames.wobblylifev2"
    },
    {
      "rank": 9,
      "appId": "com.playstack.balatro.android"
    },
    {
      "rank": 10,
      "appId": "com.humble.SlayTheSpire"
    },
    {
      "rank": 11,
      "appId": "de.schroedel.Antolin1_2"
    },
    {
      "rank": 12,
      "appId": "com.Gcenter.DefenseLegend.TowerDefense.TD.survivor.V5.Pro"
    },
    {
      "rank": 13,
      "appId": "com.noodlecake.wb"
    },
    {
      "rank": 14,
      "appId": "com.giantssoftware.fs26.google"
    },
    {
      "rank": 15,
      "appId": "com.marmalade.monopoly"
    },
    {
      "rank": 16,
      "appId": "nz.co.codepoint.minimetro"
    },
    {
      "rank": 17,
      "appId": "com.brotato.shooting.survivors.games.paid.android"
    },
    {
      "rank": 18,
      "appId": "com.doghowl.DropDuchy"
    },
    {
      "rank": 19,
      "appId": "com.RustyLake.ServantOfTheLake"
    },
    {
      "rank": 20,
      "appId": "com.playdead.limbo.full"
    },
    {
      "rank": 21,
      "appId": "com.sidekick.dwarves"
    },
    {
      "rank": 22,
      "appId": "com.RustyLake.ThePastWithin"
    },
    {
      "rank": 23,
      "appId": "com.and.games505.TerrariaPaid"
    },
    {
      "rank": 24,
      "appId": "com.PanikArcade.CloverPit"
    },
    {
      "rank": 25,
      "appId": "com.scottgames.fivenightsatfreddys"
    },
    {
      "rank": 26,
      "appId": "it.rortos.realflightsimulator"
    },
    {
      "rank": 27,
      "appId": "com.fastemulator.gba"
    },
    {
      "rank": 28,
      "appId": "com.direwolfdigital.root"
    },
    {
      "rank": 29,
      "appId": "com.mintrocket.drmobile"
    },
    {
      "rank": 30,
      "appId": "com.sofarsogood.incredibox"
    },
    {
      "rank": 31,
      "appId": "com.ustwo.monumentvalley"
    },
    {
      "rank": 32,
      "appId": "com.xd.tabs.google"
    },
    {
      "rank": 33,
      "appId": "com.llc3909.papersplease"
    },
    {
      "rank": 34,
      "appId": "com.GameCoaster.DungeonWithin"
    },
    {
      "rank": 35,
      "appId": "com.drycactus.polybridge2"
    },
    {
      "rank": 36,
      "appId": "com.countlessnights.diceamillion"
    },
    {
      "rank": 37,
      "appId": "de.schroedel.Antolin3_4"
    },
    {
      "rank": 38,
      "appId": "com.FireproofStudios.TheRoom"
    },
    {
      "rank": 39,
      "appId": "com.playdigious.seaofstars"
    },
    {
      "rank": 40,
      "appId": "com.bitzooma.blackborder2"
    },
    {
      "rank": 41,
      "appId": "com.RobotGentleman.game60SecondsReatomized"
    },
    {
      "rank": 42,
      "appId": "com.playdigious.northgard"
    },
    {
      "rank": 43,
      "appId": "com.giantssoftware.fs23.google"
    },
    {
      "rank": 44,
      "appId": "com.strayfawnstudio.gambonanza"
    },
    {
      "rank": 45,
      "appId": "com.nekki.vector.paid"
    },
    {
      "rank": 46,
      "appId": "com.atari.mobile.rctclassic"
    },
    {
      "rank": 47,
      "appId": "com.GameCoaster.ProtectDungeon"
    },
    {
      "rank": 48,
      "appId": "net.kairosoft.android.fashion"
    },
    {
      "rank": 49,
      "appId": "com.asmodeedigital.terraformingmars"
    },
    {
      "rank": 50,
      "appId": "com.direwolfdigital.munchkin"
    },
    {
      "rank": 51,
      "appId": "com.ironhidegames.android.kingdomrushfrontiers"
    },
    {
      "rank": 52,
      "appId": "com.MOBGames.PoppyMobileChap1"
    },
    {
      "rank": 53,
      "appId": "com.hg.townsmen7"
    },
    {
      "rank": 54,
      "appId": "com.strayfawnstudio.dungeonclawlermobile"
    },
    {
      "rank": 55,
      "appId": "com.doghowlgames.thronefall"
    },
    {
      "rank": 56,
      "appId": "com.ninjakiwi.bloonstd5"
    },
    {
      "rank": 57,
      "appId": "com.infinity.traffix"
    },
    {
      "rank": 58,
      "appId": "com.bscotch.hmd"
    },
    {
      "rank": 59,
      "appId": "com.timleg.quizPro"
    },
    {
      "rank": 60,
      "appId": "com.giantssoftware.fs20.google"
    },
    {
      "rank": 61,
      "appId": "com.hg.NbFH"
    },
    {
      "rank": 62,
      "appId": "com.Level5.LT1REU"
    },
    {
      "rank": 63,
      "appId": "com.greenheartgames.gdt"
    },
    {
      "rank": 64,
      "appId": "com.the10tons.dysmantle"
    },
    {
      "rank": 65,
      "appId": "brownmonster.app.game.rushrally3"
    },
    {
      "rank": 66,
      "appId": "com.rockstargames.gtasager"
    },
    {
      "rank": 67,
      "appId": "com.codebrewgames.pocketcity2"
    },
    {
      "rank": 68,
      "appId": "com.OneTooManyHumans.IHerdEwe"
    },
    {
      "rank": 69,
      "appId": "uk.co.revolution.bs1r.google"
    },
    {
      "rank": 70,
      "appId": "com.snapbreak.discounty"
    },
    {
      "rank": 71,
      "appId": "com.playdigious.deadcells.mobile"
    },
    {
      "rank": 72,
      "appId": "com.DMAP.Ting_WD"
    },
    {
      "rank": 73,
      "appId": "com.OskarStalberg.Townscaper"
    },
    {
      "rank": 74,
      "appId": "com.AbyteEntertainment.DealersLife2"
    },
    {
      "rank": 75,
      "appId": "com.playdigious.littlenightmare"
    },
    {
      "rank": 76,
      "appId": "com.rawfury.kingdom2crowns"
    },
    {
      "rank": 77,
      "appId": "com.unknownworlds.subnautica"
    },
    {
      "rank": 78,
      "appId": "com.AbyteEntertainment.DealersLifeLegend"
    },
    {
      "rank": 79,
      "appId": "com.playdigious.pol"
    },
    {
      "rank": 80,
      "appId": "com.headupgames.bridgeconstructorportal"
    },
    {
      "rank": 81,
      "appId": "com.coffeestain.goatsimulator3"
    },
    {
      "rank": 82,
      "appId": "com.twodboy.wog2"
    },
    {
      "rank": 83,
      "appId": "com.doghowlgames.EasyDeliveryCo"
    },
    {
      "rank": 84,
      "appId": "com.pid.caravansandwitch"
    }
  ]
}
