{
  "schemaVersion": 1,
  "snapshotId": "apple-cn-apps-top-paid-all-apps-20260925T231809870Z",
  "store": "apple",
  "market": "CN",
  "scope": "apps",
  "chart": "top-paid",
  "normalizedCategory": "all-apps",
  "storeCategory": null,
  "capturedAt": "2026-09-25T23:18:09.870Z",
  "observationDate": "2026-09-25",
  "marketTimeZone": "Asia/Shanghai",
  "marketObservationDate": "2026-09-26",
  "status": "partial",
  "expectedCount": 100,
  "actualCount": 99,
  "complete": false,
  "source": {
    "type": "apple-rss",
    "method": "rss-marketing-tools-v2",
    "url": "https://rss.marketingtools.apple.com/api/v2/cn/apps/top-paid/100/apps.json",
    "collectorVersion": "0.1.0",
    "adapterVersion": "apple-rss-v3+itunes-lookup",
    "payloadSha256": "3ca3a9bd4e7f3be686057573dad1bf2abfd62af1247cb4b171cf97978ada4c24"
  },
  "validation": {
    "previousSnapshotId": null,
    "flags": [
      "count_below_expected:99/100"
    ]
  },
  "entries": [
    {
      "rank": 1,
      "appId": "6775828757"
    },
    {
      "rank": 2,
      "appId": "6743148949"
    },
    {
      "rank": 3,
      "appId": "6741474933"
    },
    {
      "rank": 4,
      "appId": "388624839"
    },
    {
      "rank": 5,
      "appId": "6740246950"
    },
    {
      "rank": 6,
      "appId": "768160271"
    },
    {
      "rank": 7,
      "appId": "1261944766"
    },
    {
      "rank": 8,
      "appId": "954724812"
    },
    {
      "rank": 9,
      "appId": "916366645"
    },
    {
      "rank": 10,
      "appId": "1625289361"
    },
    {
      "rank": 11,
      "appId": "1600873673"
    },
    {
      "rank": 12,
      "appId": "6766922910"
    },
    {
      "rank": 13,
      "appId": "1164801111"
    },
    {
      "rank": 14,
      "appId": "6448477521"
    },
    {
      "rank": 15,
      "appId": "6800616114"
    },
    {
      "rank": 16,
      "appId": "1439723850"
    },
    {
      "rank": 17,
      "appId": "1661419573"
    },
    {
      "rank": 18,
      "appId": "1095903651"
    },
    {
      "rank": 19,
      "appId": "1464850921"
    },
    {
      "rank": 20,
      "appId": "1459749978"
    },
    {
      "rank": 21,
      "appId": "1578203914"
    },
    {
      "rank": 22,
      "appId": "898876435"
    },
    {
      "rank": 23,
      "appId": "1217732174"
    },
    {
      "rank": 24,
      "appId": "6772181771"
    },
    {
      "rank": 25,
      "appId": "1547418803"
    },
    {
      "rank": 26,
      "appId": "6472380172"
    },
    {
      "rank": 27,
      "appId": "373454750"
    },
    {
      "rank": 28,
      "appId": "6772103820"
    },
    {
      "rank": 29,
      "appId": "807317212"
    },
    {
      "rank": 30,
      "appId": "1062745479"
    },
    {
      "rank": 31,
      "appId": "1197275827"
    },
    {
      "rank": 32,
      "appId": "6742782416"
    },
    {
      "rank": 33,
      "appId": "908905093"
    },
    {
      "rank": 34,
      "appId": "469338840"
    },
    {
      "rank": 35,
      "appId": "1116905928"
    },
    {
      "rank": 36,
      "appId": "6474479684"
    },
    {
      "rank": 37,
      "appId": "373493387"
    },
    {
      "rank": 38,
      "appId": "6746705608"
    },
    {
      "rank": 39,
      "appId": "6807461021"
    },
    {
      "rank": 40,
      "appId": "998437582"
    },
    {
      "rank": 41,
      "appId": "6738114005"
    },
    {
      "rank": 42,
      "appId": "6483687891"
    },
    {
      "rank": 43,
      "appId": "6747717070"
    },
    {
      "rank": 44,
      "appId": "6499125531"
    },
    {
      "rank": 45,
      "appId": "530425820"
    },
    {
      "rank": 46,
      "appId": "432850619"
    },
    {
      "rank": 47,
      "appId": "1152396902"
    },
    {
      "rank": 48,
      "appId": "6756371706"
    },
    {
      "rank": 49,
      "appId": "6738342400"
    },
    {
      "rank": 50,
      "appId": "6752319887"
    },
    {
      "rank": 51,
      "appId": "6469514091"
    },
    {
      "rank": 52,
      "appId": "6757624445"
    },
    {
      "rank": 53,
      "appId": "6803354458"
    },
    {
      "rank": 54,
      "appId": "1064060287"
    },
    {
      "rank": 55,
      "appId": "1576763082"
    },
    {
      "rank": 56,
      "appId": "998437590"
    },
    {
      "rank": 57,
      "appId": "6754934177"
    },
    {
      "rank": 58,
      "appId": "1459076631"
    },
    {
      "rank": 59,
      "appId": "6760693468"
    },
    {
      "rank": 60,
      "appId": "6744356917"
    },
    {
      "rank": 61,
      "appId": "6761920228"
    },
    {
      "rank": 62,
      "appId": "6745145526"
    },
    {
      "rank": 63,
      "appId": "6798565102"
    },
    {
      "rank": 64,
      "appId": "6462190343"
    },
    {
      "rank": 65,
      "appId": "754105884"
    },
    {
      "rank": 66,
      "appId": "6761360838"
    },
    {
      "rank": 67,
      "appId": "6738272916"
    },
    {
      "rank": 68,
      "appId": "1117998129"
    },
    {
      "rank": 69,
      "appId": "955687901"
    },
    {
      "rank": 70,
      "appId": "1476509317"
    },
    {
      "rank": 71,
      "appId": "755018884"
    },
    {
      "rank": 72,
      "appId": "899003026"
    },
    {
      "rank": 73,
      "appId": "904237743"
    },
    {
      "rank": 74,
      "appId": "1035219562"
    },
    {
      "rank": 75,
      "appId": "1534560396"
    },
    {
      "rank": 76,
      "appId": "519411018"
    },
    {
      "rank": 77,
      "appId": "1210251567"
    },
    {
      "rank": 78,
      "appId": "1241909999"
    },
    {
      "rank": 79,
      "appId": "6443798663"
    },
    {
      "rank": 80,
      "appId": "6768196167"
    },
    {
      "rank": 81,
      "appId": "6785533800"
    },
    {
      "rank": 82,
      "appId": "1134126831"
    },
    {
      "rank": 83,
      "appId": "1513506417"
    },
    {
      "rank": 84,
      "appId": "730712409"
    },
    {
      "rank": 85,
      "appId": "577628510"
    },
    {
      "rank": 86,
      "appId": "6782088384"
    },
    {
      "rank": 87,
      "appId": "6753895889"
    },
    {
      "rank": 88,
      "appId": "1161125462"
    },
    {
      "rank": 89,
      "appId": "961227503"
    },
    {
      "rank": 90,
      "appId": "998437586"
    },
    {
      "rank": 91,
      "appId": "6744694923"
    },
    {
      "rank": 92,
      "appId": "1026740206"
    },
    {
      "rank": 93,
      "appId": "1509817154"
    },
    {
      "rank": 94,
      "appId": "1344681035"
    },
    {
      "rank": 95,
      "appId": "1163515895"
    },
    {
      "rank": 96,
      "appId": "1059718989"
    },
    {
      "rank": 97,
      "appId": "1485500283"
    },
    {
      "rank": 98,
      "appId": "6763889843"
    },
    {
      "rank": 99,
      "appId": "1515215584"
    }
  ]
}
