{
  "schemaVersion": 1,
  "snapshotId": "google-play-vn-apps-top-free-all-apps-20260919T154958461Z",
  "store": "google-play",
  "market": "VN",
  "scope": "apps",
  "chart": "top-free",
  "normalizedCategory": "all-apps",
  "storeCategory": "APPLICATION",
  "capturedAt": "2026-09-19T15:49:58.461Z",
  "observationDate": "2026-09-19",
  "marketTimeZone": "Asia/Ho_Chi_Minh",
  "marketObservationDate": "2026-09-19",
  "status": "valid",
  "expectedCount": 100,
  "actualCount": 100,
  "complete": true,
  "source": {
    "type": "google-play-scraper",
    "method": "list+app-details",
    "url": "https://play.google.com/store/apps?hl=en&gl=VN",
    "collectorVersion": "0.1.0",
    "adapterVersion": "@mradex77/google-play-scraper@1.2.0",
    "payloadSha256": "77052254d3cd25d7b5180b43fdf97a6b6b20abed523b3c1ac5187052d4a3f03a"
  },
  "validation": {
    "previousSnapshotId": null,
    "flags": []
  },
  "entries": [
    {
      "rank": 1,
      "appId": "com.larus.wolf"
    },
    {
      "rank": 2,
      "appId": "com.vnid"
    },
    {
      "rank": 3,
      "appId": "com.openai.chatgpt"
    },
    {
      "rank": 4,
      "appId": "com.ss.android.ugc.trill"
    },
    {
      "rank": 5,
      "appId": "com.facebook.orca"
    },
    {
      "rank": 6,
      "appId": "com.facebook.katana"
    },
    {
      "rank": 7,
      "appId": "com.vttm.vietteldiscovery"
    },
    {
      "rank": 8,
      "appId": "com.shopee.vn"
    },
    {
      "rank": 9,
      "appId": "com.evn.cskh.vn"
    },
    {
      "rank": 10,
      "appId": "com.google.android.apps.docs.editors.sheets"
    },
    {
      "rank": 11,
      "appId": "com.viettel.vcall"
    },
    {
      "rank": 12,
      "appId": "com.education.android.h.intelligence"
    },
    {
      "rank": 13,
      "appId": "com.mbmobile"
    },
    {
      "rank": 14,
      "appId": "vn.com.vng.zalopay"
    },
    {
      "rank": 15,
      "appId": "com.ots.c08.vnetraffic"
    },
    {
      "rank": 16,
      "appId": "com.lemon.lvoverseas"
    },
    {
      "rank": 17,
      "appId": "com.mservice.momotransfer"
    },
    {
      "rank": 18,
      "appId": "com.whatsapp"
    },
    {
      "rank": 19,
      "appId": "com.beeasy.toppay"
    },
    {
      "rank": 20,
      "appId": "com.viettel.citizens.tgdv"
    },
    {
      "rank": 21,
      "appId": "free.tube.premium.advanced.tuber"
    },
    {
      "rank": 22,
      "appId": "com.newleaf.app.android.victor"
    },
    {
      "rank": 23,
      "appId": "com.bhxhapp"
    },
    {
      "rank": 24,
      "appId": "com.zhiliaoapp.musically.go"
    },
    {
      "rank": 25,
      "appId": "com.ss.android.ttmd.video"
    },
    {
      "rank": 26,
      "appId": "com.VCB"
    },
    {
      "rank": 27,
      "appId": "com.vnpay.Agribank3g"
    },
    {
      "rank": 28,
      "appId": "com.etax.icanhan"
    },
    {
      "rank": 29,
      "appId": "com.gsm.customer"
    },
    {
      "rank": 30,
      "appId": "vn.com.lpbank.digibank"
    },
    {
      "rank": 31,
      "appId": "com.netshort.abroad"
    },
    {
      "rank": 32,
      "appId": "com.vnp.myvinaphone"
    },
    {
      "rank": 33,
      "appId": "com.bachhoaxanh"
    },
    {
      "rank": 34,
      "appId": "com.vietinbank.ipay"
    },
    {
      "rank": 35,
      "appId": "com.vnpay.bidv"
    },
    {
      "rank": 36,
      "appId": "com.google.android.youtube"
    },
    {
      "rank": 37,
      "appId": "com.grabtaxi.passenger"
    },
    {
      "rank": 38,
      "appId": "moe.shizuku.privileged.api"
    },
    {
      "rank": 39,
      "appId": "vn.com.techcombank.bb.app"
    },
    {
      "rank": 40,
      "appId": "ai.fungen.android"
    },
    {
      "rank": 41,
      "appId": "com.mm.android.smartlifeiot"
    },
    {
      "rank": 42,
      "appId": "enetviet.corp.qi.enetvietnew"
    },
    {
      "rank": 43,
      "appId": "com.google.android.apps.bard"
    },
    {
      "rank": 44,
      "appId": "com.cloudflare.onedotonedotonedotone"
    },
    {
      "rank": 45,
      "appId": "sg.bigo.live"
    },
    {
      "rank": 46,
      "appId": "org.telegram.messenger"
    },
    {
      "rank": 47,
      "appId": "com.duolingo"
    },
    {
      "rank": 48,
      "appId": "com.customcrosshair.aimpro"
    },
    {
      "rank": 49,
      "appId": "com.zing.mp3"
    },
    {
      "rank": 50,
      "appId": "com.deliverynow"
    },
    {
      "rank": 51,
      "appId": "com.trusted.cleaner.storage.ai"
    },
    {
      "rank": 52,
      "appId": "com.ezt.pdfreader.pdfviewer"
    },
    {
      "rank": 53,
      "appId": "com.facebook.lite"
    },
    {
      "rank": 54,
      "appId": "com.wejoy.weplay"
    },
    {
      "rank": 55,
      "appId": "com.fecredit.feonline"
    },
    {
      "rank": 56,
      "appId": "videomaker.photoeditor.slideshowmaker.videoeditor"
    },
    {
      "rank": 57,
      "appId": "com.fileviewer.documentguide"
    },
    {
      "rank": 58,
      "appId": "us.zoom.videomeetings"
    },
    {
      "rank": 59,
      "appId": "com.canva.editor"
    },
    {
      "rank": 60,
      "appId": "com.instagram.barcelona"
    },
    {
      "rank": 61,
      "appId": "com.oceangalaxy.camera.new"
    },
    {
      "rank": 62,
      "appId": "vn.homecredit.capp"
    },
    {
      "rank": 63,
      "appId": "com.twitter.android"
    },
    {
      "rank": 64,
      "appId": "ch.protonvpn.android"
    },
    {
      "rank": 65,
      "appId": "com.locket.Locket"
    },
    {
      "rank": 66,
      "appId": "all.documentreader.filereader.office.viewer"
    },
    {
      "rank": 67,
      "appId": "com.facebook.stella"
    },
    {
      "rank": 68,
      "appId": "com.spotify.music"
    },
    {
      "rank": 69,
      "appId": "myfiles.filemanager.fileexplorer.cleaner"
    },
    {
      "rank": 70,
      "appId": "coin.com.drama"
    },
    {
      "rank": 71,
      "appId": "com.snapchat.android"
    },
    {
      "rank": 72,
      "appId": "com.vnpay.vpbankonline"
    },
    {
      "rank": 73,
      "appId": "com.tafayor.appwatch"
    },
    {
      "rank": 74,
      "appId": "com.vpn.lat"
    },
    {
      "rank": 75,
      "appId": "vn.vtv.vtvgo"
    },
    {
      "rank": 76,
      "appId": "com.dramawave.app"
    },
    {
      "rank": 77,
      "appId": "com.instagram.android"
    },
    {
      "rank": 78,
      "appId": "mwg.tgdd.loyalty"
    },
    {
      "rank": 79,
      "appId": "com.google.android.apps.docs.editors.docs"
    },
    {
      "rank": 80,
      "appId": "com.truecaller"
    },
    {
      "rank": 81,
      "appId": "com.litatom.app"
    },
    {
      "rank": 82,
      "appId": "word.office.docxviewer.document.docx.reader"
    },
    {
      "rank": 83,
      "appId": "com.discord"
    },
    {
      "rank": 84,
      "appId": "com.starmakerinteractive.starmaker"
    },
    {
      "rank": 85,
      "appId": "com.omgproxy.faabdnetvfa"
    },
    {
      "rank": 86,
      "appId": "com.bplus.vtpay"
    },
    {
      "rank": 87,
      "appId": "com.redfinger.global"
    },
    {
      "rank": 88,
      "appId": "com.microsoft.teams"
    },
    {
      "rank": 89,
      "appId": "com.iqiyi.i18n"
    },
    {
      "rank": 90,
      "appId": "com.wah.pdfreader.boxtool"
    },
    {
      "rank": 91,
      "appId": "com.microsoft.office.word"
    },
    {
      "rank": 92,
      "appId": "com.pureit.videoplayer.tube"
    },
    {
      "rank": 93,
      "appId": "com.speeduphk.battlewing"
    },
    {
      "rank": 94,
      "appId": "com.pinterest"
    },
    {
      "rank": 95,
      "appId": "com.hay1.tintuc"
    },
    {
      "rank": 96,
      "appId": "com.phonelocator.find.friend"
    },
    {
      "rank": 97,
      "appId": "com.vivo.easyshare"
    },
    {
      "rank": 98,
      "appId": "com.mt.mtxx.mtxx"
    },
    {
      "rank": 99,
      "appId": "com.gpstracker.misky.phone"
    },
    {
      "rank": 100,
      "appId": "com.sacombank.ewallet"
    }
  ]
}
