{
  "schemaVersion": 1,
  "snapshotId": "google-play-de-games-top-grossing-all-games-20261026T085533237Z",
  "store": "google-play",
  "market": "DE",
  "scope": "games",
  "chart": "top-grossing",
  "normalizedCategory": "all-games",
  "storeCategory": "GAME",
  "capturedAt": "2026-10-26T08:55:33.237Z",
  "observationDate": "2026-10-26",
  "marketTimeZone": "Europe/Berlin",
  "marketObservationDate": "2026-10-26",
  "status": "valid",
  "expectedCount": 100,
  "actualCount": 100,
  "complete": true,
  "source": {
    "type": "google-play-scraper",
    "method": "list",
    "url": "https://play.google.com/store/games?hl=en&gl=DE",
    "collectorVersion": "0.1.0",
    "adapterVersion": "@mradex77/google-play-scraper@1.3.0",
    "payloadSha256": "4127d3f8ffbd7c53904143f50b0c977ba2b0b4be5a529338268ce0ea22cf151a"
  },
  "validation": {
    "previousSnapshotId": "google-play-de-games-top-grossing-all-games-20261025T082519298Z",
    "flags": []
  },
  "entries": [
    {
      "rank": 1,
      "appId": "com.mergegames.gossipharbor"
    },
    {
      "rank": 2,
      "appId": "com.moonactive.coinmaster"
    },
    {
      "rank": 3,
      "appId": "com.dreamgames.royalmatch"
    },
    {
      "rank": 4,
      "appId": "com.playrix.gardenscapes"
    },
    {
      "rank": 5,
      "appId": "com.roblox.client"
    },
    {
      "rank": 6,
      "appId": "com.king.candycrushsaga"
    },
    {
      "rank": 7,
      "appId": "com.playrix.township"
    },
    {
      "rank": 8,
      "appId": "com.playrix.fishdomdd.gplay"
    },
    {
      "rank": 9,
      "appId": "com.scopely.monopolygo"
    },
    {
      "rank": 10,
      "appId": "com.totalbattle"
    },
    {
      "rank": 11,
      "appId": "com.playrix.homescapes"
    },
    {
      "rank": 12,
      "appId": "com.dreamgames.royalkingdom"
    },
    {
      "rank": 13,
      "appId": "com.run.tower.defense"
    },
    {
      "rank": 14,
      "appId": "com.superplaystudios.dicedreams"
    },
    {
      "rank": 15,
      "appId": "com.fun.lastwar.gp"
    },
    {
      "rank": 16,
      "appId": "com.supercell.hayday"
    },
    {
      "rank": 17,
      "appId": "com.readygo.barrel.gp"
    },
    {
      "rank": 18,
      "appId": "com.phs.global"
    },
    {
      "rank": 19,
      "appId": "com.gof.global"
    },
    {
      "rank": 20,
      "appId": "net.peakgames.toonblast"
    },
    {
      "rank": 21,
      "appId": "com.superplaystudios.disneysolitairedreams"
    },
    {
      "rank": 22,
      "appId": "com.fatmerge.global"
    },
    {
      "rank": 23,
      "appId": "com.moonactive.cmboard"
    },
    {
      "rank": 24,
      "appId": "com.platogo.pmp"
    },
    {
      "rank": 25,
      "appId": "com.tencent.ig"
    },
    {
      "rank": 26,
      "appId": "io.randomco.travel"
    },
    {
      "rank": 27,
      "appId": "net.wooga.junes_journey_hidden_object_mystery_game"
    },
    {
      "rank": 28,
      "appId": "com.nianticlabs.pokemongo"
    },
    {
      "rank": 29,
      "appId": "com.joycastle.mergematch"
    },
    {
      "rank": 30,
      "appId": "com.cedargames.mysterytown"
    },
    {
      "rank": 31,
      "appId": "com.s01.global"
    },
    {
      "rank": 32,
      "appId": "com.king.candycrushsodasaga"
    },
    {
      "rank": 33,
      "appId": "net.supertreat.solitaire"
    },
    {
      "rank": 34,
      "appId": "com.screenshake.dominodreams"
    },
    {
      "rank": 35,
      "appId": "com.plarium.raidlegends"
    },
    {
      "rank": 36,
      "appId": "com.supercell.brawlstars"
    },
    {
      "rank": 37,
      "appId": "com.smallgiantgames.empires"
    },
    {
      "rank": 38,
      "appId": "air.com.buffalo_studios.newflashbingo"
    },
    {
      "rank": 39,
      "appId": "com.hollywood.merge"
    },
    {
      "rank": 40,
      "appId": "com.gameduell.romme.treff.kartenspiel"
    },
    {
      "rank": 41,
      "appId": "com.cola.game"
    },
    {
      "rank": 42,
      "appId": "com.funtomic.matchmasters"
    },
    {
      "rank": 43,
      "appId": "com.gamedots.seasideescape"
    },
    {
      "rank": 44,
      "appId": "com.huuuge.casino.slots"
    },
    {
      "rank": 45,
      "appId": "com.ea.gp.fifamobile"
    },
    {
      "rank": 46,
      "appId": "com.bingo.cruise.free.best.top.game"
    },
    {
      "rank": 47,
      "appId": "com.combo.yarnflow"
    },
    {
      "rank": 48,
      "appId": "com.supercell.clashofclans"
    },
    {
      "rank": 49,
      "appId": "de.merkur24.universalapp"
    },
    {
      "rank": 50,
      "appId": "com.abi.colony.flow"
    },
    {
      "rank": 51,
      "appId": "com.funplus.ts.global"
    },
    {
      "rank": 52,
      "appId": "com.ea.game.starwarscapital_row"
    },
    {
      "rank": 53,
      "appId": "com.cooking.bingo.ldkwh"
    },
    {
      "rank": 54,
      "appId": "net.peakgames.match"
    },
    {
      "rank": 55,
      "appId": "com.fatr.global"
    },
    {
      "rank": 56,
      "appId": "com.king.farmheroessaga"
    },
    {
      "rank": 57,
      "appId": "ai.heyyyy.app"
    },
    {
      "rank": 58,
      "appId": "com.loomgames.pixelflow"
    },
    {
      "rank": 59,
      "appId": "com.vigafun.funfinity.foodhunt"
    },
    {
      "rank": 60,
      "appId": "com.topgamesinc.evony"
    },
    {
      "rank": 61,
      "appId": "eu.nordeus.topeleven.android"
    },
    {
      "rank": 62,
      "appId": "com.supercell.clashroyale"
    },
    {
      "rank": 63,
      "appId": "com.funplus.kingofavalon"
    },
    {
      "rank": 64,
      "appId": "com.igg.android.lordsmobile"
    },
    {
      "rank": 65,
      "appId": "com.spark.sp.gp"
    },
    {
      "rank": 66,
      "appId": "com.games.foundation"
    },
    {
      "rank": 67,
      "appId": "com.kingsgroup.sos"
    },
    {
      "rank": 68,
      "appId": "com.project.idle.cd"
    },
    {
      "rank": 69,
      "appId": "com.rotatelab.cubeblast"
    },
    {
      "rank": 70,
      "appId": "com.monopoly.dream.idle.king"
    },
    {
      "rank": 71,
      "appId": "com.farlightgames.warline.gp.global"
    },
    {
      "rank": 72,
      "appId": "com.slg.policewar"
    },
    {
      "rank": 73,
      "appId": "com.zroute.global"
    },
    {
      "rank": 74,
      "appId": "com.huuuge.casino.texas"
    },
    {
      "rank": 75,
      "appId": "com.readygo.dark.gp"
    },
    {
      "rank": 76,
      "appId": "com.gamespark.topking.gp"
    },
    {
      "rank": 77,
      "appId": "com.lilithgame.roc.gp"
    },
    {
      "rank": 78,
      "appId": "com.zjcs.android.us"
    },
    {
      "rank": 79,
      "appId": "com.olleyo.piggy.king.free"
    },
    {
      "rank": 80,
      "appId": "com.moonactive.jellybusters"
    },
    {
      "rank": 81,
      "appId": "com.innplaylabs.animalkingdomraid"
    },
    {
      "rank": 82,
      "appId": "jp.pokemon.pokemontcgp"
    },
    {
      "rank": 83,
      "appId": "com.justgame.jails"
    },
    {
      "rank": 84,
      "appId": "com.gameduell.skat.treff.kartenspiel"
    },
    {
      "rank": 85,
      "appId": "de.whow.jackpot"
    },
    {
      "rank": 86,
      "appId": "com.mojang.minecraftpe"
    },
    {
      "rank": 87,
      "appId": "com.merge.game.foodstars"
    },
    {
      "rank": 88,
      "appId": "com.funfizz.palmon.gp"
    },
    {
      "rank": 89,
      "appId": "com.diandian.gog"
    },
    {
      "rank": 90,
      "appId": "com.zynga.pottermatch"
    },
    {
      "rank": 91,
      "appId": "com.com2us.smon.normal.freefull.google.kr.android.common"
    },
    {
      "rank": 92,
      "appId": "com.mobile.legends"
    },
    {
      "rank": 93,
      "appId": "com.blizzard.wtcg.hearthstone"
    },
    {
      "rank": 94,
      "appId": "com.hnhs.endlesssea.gp"
    },
    {
      "rank": 95,
      "appId": "com.MelsoftGames.FamilyIslandFarm"
    },
    {
      "rank": 96,
      "appId": "com.vizorapps.klondike"
    },
    {
      "rank": 97,
      "appId": "com.everywear.game5"
    },
    {
      "rank": 98,
      "appId": "com.nexters.herowars"
    },
    {
      "rank": 99,
      "appId": "com.multicastgames.butcher"
    },
    {
      "rank": 100,
      "appId": "com.pockethaven.roguelegend"
    }
  ]
}
