{
  "schemaVersion": 1,
  "snapshotId": "apple-jp-games-top-paid-all-games-20261001T231318407Z",
  "store": "apple",
  "market": "JP",
  "scope": "games",
  "chart": "top-paid",
  "normalizedCategory": "all-games",
  "storeCategory": "6014",
  "capturedAt": "2026-10-01T23:13:18.407Z",
  "observationDate": "2026-10-01",
  "marketTimeZone": "Asia/Tokyo",
  "marketObservationDate": "2026-10-02",
  "status": "partial",
  "expectedCount": 100,
  "actualCount": 99,
  "complete": false,
  "source": {
    "type": "apple-rss",
    "method": "itunes-rss-category",
    "url": "https://itunes.apple.com/jp/rss/toppaidapplications/limit=100/genre=6014/json",
    "collectorVersion": "0.1.0",
    "adapterVersion": "apple-rss-v4+itunes-lookup",
    "payloadSha256": "fce4add0565ce105fa3cce6c681b5c994d8801cd35da7670910d5901b90d88a9"
  },
  "validation": {
    "previousSnapshotId": null,
    "flags": [
      "count_below_expected:99/100"
    ]
  },
  "entries": [
    {
      "rank": 1,
      "appId": "1542957396"
    },
    {
      "rank": 2,
      "appId": "479516143"
    },
    {
      "rank": 3,
      "appId": "6810914372"
    },
    {
      "rank": 4,
      "appId": "6469114836"
    },
    {
      "rank": 5,
      "appId": "6802539506"
    },
    {
      "rank": 6,
      "appId": "6762255813"
    },
    {
      "rank": 7,
      "appId": "6757778100"
    },
    {
      "rank": 8,
      "appId": "6762605506"
    },
    {
      "rank": 9,
      "appId": "6790289724"
    },
    {
      "rank": 10,
      "appId": "1491530147"
    },
    {
      "rank": 11,
      "appId": "6760401505"
    },
    {
      "rank": 12,
      "appId": "1361473095"
    },
    {
      "rank": 13,
      "appId": "6761606472"
    },
    {
      "rank": 14,
      "appId": "6547834967"
    },
    {
      "rank": 15,
      "appId": "933111586"
    },
    {
      "rank": 16,
      "appId": "1496918059"
    },
    {
      "rank": 17,
      "appId": "6754688764"
    },
    {
      "rank": 18,
      "appId": "6747757142"
    },
    {
      "rank": 19,
      "appId": "6741251510"
    },
    {
      "rank": 20,
      "appId": "6747067433"
    },
    {
      "rank": 21,
      "appId": "6759664029"
    },
    {
      "rank": 22,
      "appId": "6752765295"
    },
    {
      "rank": 23,
      "appId": "6754894237"
    },
    {
      "rank": 24,
      "appId": "6670469064"
    },
    {
      "rank": 25,
      "appId": "1406710800"
    },
    {
      "rank": 26,
      "appId": "6761354266"
    },
    {
      "rank": 27,
      "appId": "6786246807"
    },
    {
      "rank": 28,
      "appId": "1468034815"
    },
    {
      "rank": 29,
      "appId": "525818839"
    },
    {
      "rank": 30,
      "appId": "6760749740"
    },
    {
      "rank": 31,
      "appId": "6759667009"
    },
    {
      "rank": 32,
      "appId": "6759634099"
    },
    {
      "rank": 33,
      "appId": "949737947"
    },
    {
      "rank": 34,
      "appId": "793660476"
    },
    {
      "rank": 35,
      "appId": "1372670435"
    },
    {
      "rank": 36,
      "appId": "793749059"
    },
    {
      "rank": 37,
      "appId": "6768917844"
    },
    {
      "rank": 38,
      "appId": "6476544023"
    },
    {
      "rank": 39,
      "appId": "1349292121"
    },
    {
      "rank": 40,
      "appId": "6758328352"
    },
    {
      "rank": 41,
      "appId": "730263398"
    },
    {
      "rank": 42,
      "appId": "6761328517"
    },
    {
      "rank": 43,
      "appId": "6502453075"
    },
    {
      "rank": 44,
      "appId": "6572290447"
    },
    {
      "rank": 45,
      "appId": "1456547302"
    },
    {
      "rank": 46,
      "appId": "6463375487"
    },
    {
      "rank": 47,
      "appId": "837860959"
    },
    {
      "rank": 48,
      "appId": "6801787689"
    },
    {
      "rank": 49,
      "appId": "6749560544"
    },
    {
      "rank": 50,
      "appId": "6758508981"
    },
    {
      "rank": 51,
      "appId": "1573482724"
    },
    {
      "rank": 52,
      "appId": "1350400235"
    },
    {
      "rank": 53,
      "appId": "1319618742"
    },
    {
      "rank": 54,
      "appId": "1642707350"
    },
    {
      "rank": 55,
      "appId": "6795586467"
    },
    {
      "rank": 56,
      "appId": "1093131935"
    },
    {
      "rank": 57,
      "appId": "6759147233"
    },
    {
      "rank": 58,
      "appId": "6756707224"
    },
    {
      "rank": 59,
      "appId": "1548403918"
    },
    {
      "rank": 60,
      "appId": "6755099956"
    },
    {
      "rank": 61,
      "appId": "6756000393"
    },
    {
      "rank": 62,
      "appId": "479428095"
    },
    {
      "rank": 63,
      "appId": "1575492423"
    },
    {
      "rank": 64,
      "appId": "6504323939"
    },
    {
      "rank": 65,
      "appId": "1522407890"
    },
    {
      "rank": 66,
      "appId": "1456714515"
    },
    {
      "rank": 67,
      "appId": "6670434812"
    },
    {
      "rank": 68,
      "appId": "6748751735"
    },
    {
      "rank": 69,
      "appId": "6473873659"
    },
    {
      "rank": 70,
      "appId": "1596736236"
    },
    {
      "rank": 71,
      "appId": "6443445179"
    },
    {
      "rank": 72,
      "appId": "6449832222"
    },
    {
      "rank": 73,
      "appId": "6739296209"
    },
    {
      "rank": 74,
      "appId": "6478494156"
    },
    {
      "rank": 75,
      "appId": "1590990535"
    },
    {
      "rank": 76,
      "appId": "6463374016"
    },
    {
      "rank": 77,
      "appId": "1356172905"
    },
    {
      "rank": 78,
      "appId": "6759313629"
    },
    {
      "rank": 79,
      "appId": "935216956"
    },
    {
      "rank": 80,
      "appId": "1444761746"
    },
    {
      "rank": 81,
      "appId": "6742165091"
    },
    {
      "rank": 82,
      "appId": "1034159412"
    },
    {
      "rank": 83,
      "appId": "1435456830"
    },
    {
      "rank": 84,
      "appId": "6751231357"
    },
    {
      "rank": 85,
      "appId": "6759427578"
    },
    {
      "rank": 86,
      "appId": "912536422"
    },
    {
      "rank": 87,
      "appId": "1492041611"
    },
    {
      "rank": 88,
      "appId": "1094038347"
    },
    {
      "rank": 89,
      "appId": "1492041539"
    },
    {
      "rank": 90,
      "appId": "6743115658"
    },
    {
      "rank": 91,
      "appId": "763692274"
    },
    {
      "rank": 92,
      "appId": "1477966166"
    },
    {
      "rank": 93,
      "appId": "6466296603"
    },
    {
      "rank": 94,
      "appId": "6738784092"
    },
    {
      "rank": 95,
      "appId": "6749255805"
    },
    {
      "rank": 96,
      "appId": "6755809787"
    },
    {
      "rank": 97,
      "appId": "1357651989"
    },
    {
      "rank": 98,
      "appId": "6755711513"
    },
    {
      "rank": 99,
      "appId": "6755508035"
    }
  ]
}
