{
  "schemaVersion": 1,
  "snapshotId": "apple-cn-apps-top-free-all-apps-20260929T234310133Z",
  "store": "apple",
  "market": "CN",
  "scope": "apps",
  "chart": "top-free",
  "normalizedCategory": "all-apps",
  "storeCategory": null,
  "capturedAt": "2026-09-29T23:43:10.133Z",
  "observationDate": "2026-09-29",
  "marketTimeZone": "Asia/Shanghai",
  "marketObservationDate": "2026-09-30",
  "status": "valid",
  "expectedCount": 100,
  "actualCount": 100,
  "complete": true,
  "source": {
    "type": "apple-rss",
    "method": "rss-marketing-tools-v2",
    "url": "https://rss.marketingtools.apple.com/api/v2/cn/apps/top-free/100/apps.json",
    "collectorVersion": "0.1.0",
    "adapterVersion": "apple-rss-v4+itunes-lookup",
    "payloadSha256": "740caa43ce0704908aa6c4e817a49fd5746cf5c638bfe66e1c23d6de89559c7b"
  },
  "validation": {
    "previousSnapshotId": "apple-cn-apps-top-free-all-apps-20260929T002153249Z",
    "flags": []
  },
  "entries": [
    {
      "rank": 1,
      "appId": "1485191072"
    },
    {
      "rank": 2,
      "appId": "6451407032"
    },
    {
      "rank": 3,
      "appId": "6745890963"
    },
    {
      "rank": 4,
      "appId": "6459478672"
    },
    {
      "rank": 5,
      "appId": "6466733523"
    },
    {
      "rank": 6,
      "appId": "1605585211"
    },
    {
      "rank": 7,
      "appId": "1588080869"
    },
    {
      "rank": 8,
      "appId": "6756863766"
    },
    {
      "rank": 9,
      "appId": "1488854568"
    },
    {
      "rank": 10,
      "appId": "564818797"
    },
    {
      "rank": 11,
      "appId": "600273928"
    },
    {
      "rank": 12,
      "appId": "510909506"
    },
    {
      "rank": 13,
      "appId": "6468941332"
    },
    {
      "rank": 14,
      "appId": "583700738"
    },
    {
      "rank": 15,
      "appId": "977946724"
    },
    {
      "rank": 16,
      "appId": "1458072671"
    },
    {
      "rank": 17,
      "appId": "461703208"
    },
    {
      "rank": 18,
      "appId": "414245413"
    },
    {
      "rank": 19,
      "appId": "351091731"
    },
    {
      "rank": 20,
      "appId": "515651240"
    },
    {
      "rank": 21,
      "appId": "1484048379"
    },
    {
      "rank": 22,
      "appId": "513829338"
    },
    {
      "rank": 23,
      "appId": "1039727169"
    },
    {
      "rank": 24,
      "appId": "1044283059"
    },
    {
      "rank": 25,
      "appId": "1503466530"
    },
    {
      "rank": 26,
      "appId": "1500526240"
    },
    {
      "rank": 27,
      "appId": "1002355194"
    },
    {
      "rank": 28,
      "appId": "387682726"
    },
    {
      "rank": 29,
      "appId": "423084029"
    },
    {
      "rank": 30,
      "appId": "333206289"
    },
    {
      "rank": 31,
      "appId": "475966832"
    },
    {
      "rank": 32,
      "appId": "6749835845"
    },
    {
      "rank": 33,
      "appId": "1142110895"
    },
    {
      "rank": 34,
      "appId": "1160172628"
    },
    {
      "rank": 35,
      "appId": "741292507"
    },
    {
      "rank": 36,
      "appId": "879996273"
    },
    {
      "rank": 37,
      "appId": "6752317272"
    },
    {
      "rank": 38,
      "appId": "1087897068"
    },
    {
      "rank": 39,
      "appId": "547166701"
    },
    {
      "rank": 40,
      "appId": "1431720653"
    },
    {
      "rank": 41,
      "appId": "586871187"
    },
    {
      "rank": 42,
      "appId": "440948110"
    },
    {
      "rank": 43,
      "appId": "423514795"
    },
    {
      "rank": 44,
      "appId": "414478124"
    },
    {
      "rank": 45,
      "appId": "444934666"
    },
    {
      "rank": 46,
      "appId": "554499054"
    },
    {
      "rank": 47,
      "appId": "570060128"
    },
    {
      "rank": 48,
      "appId": "1012871328"
    },
    {
      "rank": 49,
      "appId": "391965015"
    },
    {
      "rank": 50,
      "appId": "473225145"
    },
    {
      "rank": 51,
      "appId": "736536022"
    },
    {
      "rank": 52,
      "appId": "513836029"
    },
    {
      "rank": 53,
      "appId": "1319071502"
    },
    {
      "rank": 54,
      "appId": "887314963"
    },
    {
      "rank": 55,
      "appId": "930368978"
    },
    {
      "rank": 56,
      "appId": "507097717"
    },
    {
      "rank": 57,
      "appId": "6751240418"
    },
    {
      "rank": 58,
      "appId": "6743828427"
    },
    {
      "rank": 59,
      "appId": "599852710"
    },
    {
      "rank": 60,
      "appId": "379395415"
    },
    {
      "rank": 61,
      "appId": "388627783"
    },
    {
      "rank": 62,
      "appId": "1479814602"
    },
    {
      "rank": 63,
      "appId": "1468454200"
    },
    {
      "rank": 64,
      "appId": "399608199"
    },
    {
      "rank": 65,
      "appId": "458318329"
    },
    {
      "rank": 66,
      "appId": "6761374913"
    },
    {
      "rank": 67,
      "appId": "416048305"
    },
    {
      "rank": 68,
      "appId": "1472502819"
    },
    {
      "rank": 69,
      "appId": "895682747"
    },
    {
      "rank": 70,
      "appId": "416457422"
    },
    {
      "rank": 71,
      "appId": "590338362"
    },
    {
      "rank": 72,
      "appId": "493489515"
    },
    {
      "rank": 73,
      "appId": "414603431"
    },
    {
      "rank": 74,
      "appId": "395096736"
    },
    {
      "rank": 75,
      "appId": "370139302"
    },
    {
      "rank": 76,
      "appId": "350962117"
    },
    {
      "rank": 77,
      "appId": "336141475"
    },
    {
      "rank": 78,
      "appId": "1435602536"
    },
    {
      "rank": 79,
      "appId": "1054598922"
    },
    {
      "rank": 80,
      "appId": "382201985"
    },
    {
      "rank": 81,
      "appId": "957323480"
    },
    {
      "rank": 82,
      "appId": "472208016"
    },
    {
      "rank": 83,
      "appId": "392899425"
    },
    {
      "rank": 84,
      "appId": "818237113"
    },
    {
      "rank": 85,
      "appId": "1436002627"
    },
    {
      "rank": 86,
      "appId": "6755949705"
    },
    {
      "rank": 87,
      "appId": "1260489449"
    },
    {
      "rank": 88,
      "appId": "6736794948"
    },
    {
      "rank": 89,
      "appId": "480079300"
    },
    {
      "rank": 90,
      "appId": "1063183999"
    },
    {
      "rank": 91,
      "appId": "6737597349"
    },
    {
      "rank": 92,
      "appId": "480161784"
    },
    {
      "rank": 93,
      "appId": "1493500777"
    },
    {
      "rank": 94,
      "appId": "1672267376"
    },
    {
      "rank": 95,
      "appId": "406170251"
    },
    {
      "rank": 96,
      "appId": "803781859"
    },
    {
      "rank": 97,
      "appId": "1475199599"
    },
    {
      "rank": 98,
      "appId": "6473782436"
    },
    {
      "rank": 99,
      "appId": "393765873"
    },
    {
      "rank": 100,
      "appId": "1401729613"
    }
  ]
}
