{
  "schemaVersion": 1,
  "snapshotId": "apple-vn-games-top-free-all-games-20261018T231553561Z",
  "store": "apple",
  "market": "VN",
  "scope": "games",
  "chart": "top-free",
  "normalizedCategory": "all-games",
  "storeCategory": "6014",
  "capturedAt": "2026-10-18T23:15:53.561Z",
  "observationDate": "2026-10-18",
  "marketTimeZone": "Asia/Ho_Chi_Minh",
  "marketObservationDate": "2026-10-19",
  "status": "valid",
  "expectedCount": 100,
  "actualCount": 100,
  "complete": true,
  "source": {
    "type": "apple-rss",
    "method": "itunes-rss-category",
    "url": "https://itunes.apple.com/vn/rss/topfreeapplications/limit=100/genre=6014/json",
    "collectorVersion": "0.1.0",
    "adapterVersion": "apple-rss-v4+itunes-lookup",
    "payloadSha256": "2baca06301b28b78c4c4eb904bd6233e124fb99a0a948ba34f44217c0bf86a80"
  },
  "validation": {
    "previousSnapshotId": "apple-vn-games-top-free-all-games-20261017T230930679Z",
    "flags": []
  },
  "entries": [
    {
      "rank": 1,
      "appId": "6757412443"
    },
    {
      "rank": 2,
      "appId": "1150288115"
    },
    {
      "rank": 3,
      "appId": "6474715805"
    },
    {
      "rank": 4,
      "appId": "1300146617"
    },
    {
      "rank": 5,
      "appId": "6803825299"
    },
    {
      "rank": 6,
      "appId": "6737226348"
    },
    {
      "rank": 7,
      "appId": "1480516829"
    },
    {
      "rank": 8,
      "appId": "6756482832"
    },
    {
      "rank": 9,
      "appId": "1612175933"
    },
    {
      "rank": 10,
      "appId": "6748084174"
    },
    {
      "rank": 11,
      "appId": "6670604287"
    },
    {
      "rank": 12,
      "appId": "6762586387"
    },
    {
      "rank": 13,
      "appId": "6762122743"
    },
    {
      "rank": 14,
      "appId": "6746743297"
    },
    {
      "rank": 15,
      "appId": "6758662578"
    },
    {
      "rank": 16,
      "appId": "6771715056"
    },
    {
      "rank": 17,
      "appId": "1505663005"
    },
    {
      "rank": 18,
      "appId": "6805887718"
    },
    {
      "rank": 19,
      "appId": "6747109536"
    },
    {
      "rank": 20,
      "appId": "1089336971"
    },
    {
      "rank": 21,
      "appId": "6754014472"
    },
    {
      "rank": 22,
      "appId": "6768233176"
    },
    {
      "rank": 23,
      "appId": "6816424202"
    },
    {
      "rank": 24,
      "appId": "553834731"
    },
    {
      "rank": 25,
      "appId": "1438396625"
    },
    {
      "rank": 26,
      "appId": "893677096"
    },
    {
      "rank": 27,
      "appId": "6575363756"
    },
    {
      "rank": 28,
      "appId": "6757736102"
    },
    {
      "rank": 29,
      "appId": "981633844"
    },
    {
      "rank": 30,
      "appId": "1443446174"
    },
    {
      "rank": 31,
      "appId": "6780891673"
    },
    {
      "rank": 32,
      "appId": "1477841973"
    },
    {
      "rank": 33,
      "appId": "6760325543"
    },
    {
      "rank": 34,
      "appId": "1562817072"
    },
    {
      "rank": 35,
      "appId": "6802040774"
    },
    {
      "rank": 36,
      "appId": "657500465"
    },
    {
      "rank": 37,
      "appId": "1183149712"
    },
    {
      "rank": 38,
      "appId": "6478063606"
    },
    {
      "rank": 39,
      "appId": "1423046460"
    },
    {
      "rank": 40,
      "appId": "6498920694"
    },
    {
      "rank": 41,
      "appId": "1604603007"
    },
    {
      "rank": 42,
      "appId": "6785442752"
    },
    {
      "rank": 43,
      "appId": "1540197003"
    },
    {
      "rank": 44,
      "appId": "6740632670"
    },
    {
      "rank": 45,
      "appId": "6504188939"
    },
    {
      "rank": 46,
      "appId": "6453700466"
    },
    {
      "rank": 47,
      "appId": "6450917563"
    },
    {
      "rank": 48,
      "appId": "6738694162"
    },
    {
      "rank": 49,
      "appId": "6747063674"
    },
    {
      "rank": 50,
      "appId": "1435297178"
    },
    {
      "rank": 51,
      "appId": "6772117224"
    },
    {
      "rank": 52,
      "appId": "1570746506"
    },
    {
      "rank": 53,
      "appId": "6772975295"
    },
    {
      "rank": 54,
      "appId": "1610874732"
    },
    {
      "rank": 55,
      "appId": "6770503071"
    },
    {
      "rank": 56,
      "appId": "1357967682"
    },
    {
      "rank": 57,
      "appId": "1467762267"
    },
    {
      "rank": 58,
      "appId": "1415712748"
    },
    {
      "rank": 59,
      "appId": "6759763476"
    },
    {
      "rank": 60,
      "appId": "6746398630"
    },
    {
      "rank": 61,
      "appId": "6789188503"
    },
    {
      "rank": 62,
      "appId": "6451463643"
    },
    {
      "rank": 63,
      "appId": "6448104157"
    },
    {
      "rank": 64,
      "appId": "6793924927"
    },
    {
      "rank": 65,
      "appId": "1528287521"
    },
    {
      "rank": 66,
      "appId": "1509872509"
    },
    {
      "rank": 67,
      "appId": "1337578317"
    },
    {
      "rank": 68,
      "appId": "6748588650"
    },
    {
      "rank": 69,
      "appId": "1531280382"
    },
    {
      "rank": 70,
      "appId": "1389111413"
    },
    {
      "rank": 71,
      "appId": "6785691571"
    },
    {
      "rank": 72,
      "appId": "6747957875"
    },
    {
      "rank": 73,
      "appId": "6470471626"
    },
    {
      "rank": 74,
      "appId": "6813373853"
    },
    {
      "rank": 75,
      "appId": "6468942281"
    },
    {
      "rank": 76,
      "appId": "6740910225"
    },
    {
      "rank": 77,
      "appId": "6752849675"
    },
    {
      "rank": 78,
      "appId": "6480279388"
    },
    {
      "rank": 79,
      "appId": "6767091927"
    },
    {
      "rank": 80,
      "appId": "6769819313"
    },
    {
      "rank": 81,
      "appId": "572395608"
    },
    {
      "rank": 82,
      "appId": "6747710694"
    },
    {
      "rank": 83,
      "appId": "6761100469"
    },
    {
      "rank": 84,
      "appId": "1547549647"
    },
    {
      "rank": 85,
      "appId": "1434807653"
    },
    {
      "rank": 86,
      "appId": "911550133"
    },
    {
      "rank": 87,
      "appId": "6451477469"
    },
    {
      "rank": 88,
      "appId": "1477336151"
    },
    {
      "rank": 89,
      "appId": "6764201639"
    },
    {
      "rank": 90,
      "appId": "1118431695"
    },
    {
      "rank": 91,
      "appId": "1001780528"
    },
    {
      "rank": 92,
      "appId": "1193508329"
    },
    {
      "rank": 93,
      "appId": "6447961802"
    },
    {
      "rank": 94,
      "appId": "1536584509"
    },
    {
      "rank": 95,
      "appId": "1323957120"
    },
    {
      "rank": 96,
      "appId": "6445982244"
    },
    {
      "rank": 97,
      "appId": "6472133989"
    },
    {
      "rank": 98,
      "appId": "6449243946"
    },
    {
      "rank": 99,
      "appId": "1635978552"
    },
    {
      "rank": 100,
      "appId": "6790705899"
    }
  ]
}
