{
  "schemaVersion": 1,
  "snapshotId": "google-play-us-games-top-free-all-games-20261025T131249512Z",
  "store": "google-play",
  "market": "US",
  "scope": "games",
  "chart": "top-free",
  "normalizedCategory": "all-games",
  "storeCategory": "GAME",
  "capturedAt": "2026-10-25T13:12:49.512Z",
  "observationDate": "2026-10-25",
  "marketTimeZone": "America/New_York",
  "marketObservationDate": "2026-10-25",
  "status": "valid",
  "expectedCount": 100,
  "actualCount": 100,
  "complete": true,
  "source": {
    "type": "google-play-scraper",
    "method": "list",
    "url": "https://play.google.com/store/games?hl=en&gl=US",
    "collectorVersion": "0.1.0",
    "adapterVersion": "@mradex77/google-play-scraper@1.3.0",
    "payloadSha256": "b09c8e24f2ba28b2d26d2f0cd9decf678c4227e7787016855fe7e192132beb30"
  },
  "validation": {
    "previousSnapshotId": "google-play-us-games-top-free-all-games-20261024T124201923Z",
    "flags": []
  },
  "entries": [
    {
      "rank": 1,
      "appId": "com.mergegames.gossipharbor"
    },
    {
      "rank": 2,
      "appId": "com.oakever.meowdoku"
    },
    {
      "rank": 3,
      "appId": "com.nebula.rotaterings"
    },
    {
      "rank": 4,
      "appId": "com.cyphergames.royalsmash"
    },
    {
      "rank": 5,
      "appId": "com.agavegames.wordtiles"
    },
    {
      "rank": 6,
      "appId": "com.roblox.client"
    },
    {
      "rank": 7,
      "appId": "com.oakever.arrows"
    },
    {
      "rank": 8,
      "appId": "com.grandgames.magicsort"
    },
    {
      "rank": 9,
      "appId": "com.vitastudio.mahjong"
    },
    {
      "rank": 10,
      "appId": "com.block.juggle"
    },
    {
      "rank": 11,
      "appId": "io.supercent.bulldozermasters"
    },
    {
      "rank": 12,
      "appId": "gridplus.busjam.carpuzzle"
    },
    {
      "rank": 13,
      "appId": "com.scopely.monopolygo"
    },
    {
      "rank": 14,
      "appId": "com.brain.crazy.joygame"
    },
    {
      "rank": 15,
      "appId": "com.fungames.blockcraft"
    },
    {
      "rank": 16,
      "appId": "com.tank.busters"
    },
    {
      "rank": 17,
      "appId": "com.superplaystudios.disneysolitairedreams"
    },
    {
      "rank": 18,
      "appId": "com.fidget.dumplingparty"
    },
    {
      "rank": 19,
      "appId": "in.playsimple.wordsearch"
    },
    {
      "rank": 20,
      "appId": "com.uncosoft.wordpuzzle"
    },
    {
      "rank": 21,
      "appId": "com.Garawell.LoopSort"
    },
    {
      "rank": 22,
      "appId": "com.farlightgames.warline.gp.global"
    },
    {
      "rank": 23,
      "appId": "com.pocket.sort.coin.puzzle.game"
    },
    {
      "rank": 24,
      "appId": "com.nebula.mahjongtile"
    },
    {
      "rank": 25,
      "appId": "com.flow.smashparty"
    },
    {
      "rank": 26,
      "appId": "com.tfgco.apps.coloring.free.color.by.number"
    },
    {
      "rank": 27,
      "appId": "com.playrix.township"
    },
    {
      "rank": 28,
      "appId": "com.combo.yarnflow"
    },
    {
      "rank": 29,
      "appId": "com.RC67.surprise.dumpling.ASMR.box"
    },
    {
      "rank": 30,
      "appId": "com.youmusic.magictiles"
    },
    {
      "rank": 31,
      "appId": "com.vincentb.MobControl"
    },
    {
      "rank": 32,
      "appId": "com.puzzlegames.puzzlebrickslegend"
    },
    {
      "rank": 33,
      "appId": "com.dreamgames.royalkingdom"
    },
    {
      "rank": 34,
      "appId": "com.mimik.challenge.fun"
    },
    {
      "rank": 35,
      "appId": "com.kayac.slow_mo_strike"
    },
    {
      "rank": 36,
      "appId": "com.girlsecho.gp"
    },
    {
      "rank": 37,
      "appId": "com.ocedomin.fishio"
    },
    {
      "rank": 38,
      "appId": "io.voodoo.paper2"
    },
    {
      "rank": 39,
      "appId": "com.greatplay.farklecash"
    },
    {
      "rank": 40,
      "appId": "com.tripledot.blockbash"
    },
    {
      "rank": 41,
      "appId": "com.miniclip.eightballpool"
    },
    {
      "rank": 42,
      "appId": "com.brain.puzzle.tricky.test.annoying.quest"
    },
    {
      "rank": 43,
      "appId": "com.ecffri.arrows"
    },
    {
      "rank": 44,
      "appId": "com.blast.puzzlegame.bear"
    },
    {
      "rank": 45,
      "appId": "com.leap.searchit"
    },
    {
      "rank": 46,
      "appId": "in.playsimple.wordtrip.association"
    },
    {
      "rank": 47,
      "appId": "com.dreamgames.royalmatch"
    },
    {
      "rank": 48,
      "appId": "com.nebula.splashbuster"
    },
    {
      "rank": 49,
      "appId": "com.mahjong.master.solitaire.match.puzzle"
    },
    {
      "rank": 50,
      "appId": "triple.sorting.bubble.fish.match"
    },
    {
      "rank": 51,
      "appId": "com.superplaystudios.dicedreams"
    },
    {
      "rank": 52,
      "appId": "io.voodoo.holeio"
    },
    {
      "rank": 53,
      "appId": "com.abi.colony.flow"
    },
    {
      "rank": 54,
      "appId": "com.epicgames.fortnite"
    },
    {
      "rank": 55,
      "appId": "com.robtopx.geometryjumplite"
    },
    {
      "rank": 56,
      "appId": "com.pawakuma.hitfortune"
    },
    {
      "rank": 57,
      "appId": "com.kiloo.subwaysurf"
    },
    {
      "rank": 58,
      "appId": "com.brain.logic.joygame"
    },
    {
      "rank": 59,
      "appId": "com.thrivegames.bashbest"
    },
    {
      "rank": 60,
      "appId": "com.metax.obby.escape.run"
    },
    {
      "rank": 61,
      "appId": "com.GybeGames.ColorBlockJam"
    },
    {
      "rank": 62,
      "appId": "com.tripledot.angrysmash"
    },
    {
      "rank": 63,
      "appId": "com.oakever.jigsawcard"
    },
    {
      "rank": 64,
      "appId": "jp.co.goodroid.hyper.puzzle.arrows3dcubepuzzle"
    },
    {
      "rank": 65,
      "appId": "com.gimica.treasuremaster"
    },
    {
      "rank": 66,
      "appId": "com.epicoro.castleclashers"
    },
    {
      "rank": 67,
      "appId": "com.dts.freefireth"
    },
    {
      "rank": 68,
      "appId": "com.pixel.art.coloring.color.number"
    },
    {
      "rank": 69,
      "appId": "com.pic.blast.solitaire"
    },
    {
      "rank": 70,
      "appId": "com.metagame.annoying.trick.brainypuzzle"
    },
    {
      "rank": 71,
      "appId": "com.rotatelab.cubeblast"
    },
    {
      "rank": 72,
      "appId": "com.rovio.baba"
    },
    {
      "rank": 73,
      "appId": "io.heseri.car"
    },
    {
      "rank": 74,
      "appId": "com.king.candycrushsaga"
    },
    {
      "rank": 75,
      "appId": "com.sled.surfers.game"
    },
    {
      "rank": 76,
      "appId": "com.tripledot.blockssmashgame"
    },
    {
      "rank": 77,
      "appId": "com.lavalabs.autodrill"
    },
    {
      "rank": 78,
      "appId": "com.hollywood.merge"
    },
    {
      "rank": 79,
      "appId": "com.easybrain.arrow.puzzle.game"
    },
    {
      "rank": 80,
      "appId": "hidden.object.find.seek.search.mystery.puzzle.games.free"
    },
    {
      "rank": 81,
      "appId": "solitaire.patience.card.games.klondike.free"
    },
    {
      "rank": 82,
      "appId": "com.moonactive.holestars"
    },
    {
      "rank": 83,
      "appId": "com.s01.global"
    },
    {
      "rank": 84,
      "appId": "com.oakever.tiletrip"
    },
    {
      "rank": 85,
      "appId": "com.uc.minigame.relax"
    },
    {
      "rank": 86,
      "appId": "com.tocaboca.tocalifeworld"
    },
    {
      "rank": 87,
      "appId": "com.tripledot.spades"
    },
    {
      "rank": 88,
      "appId": "com.rescue.agent"
    },
    {
      "rank": 89,
      "appId": "com.activision.callofduty.shooter"
    },
    {
      "rank": 90,
      "appId": "com.smilerlee.klondike"
    },
    {
      "rank": 91,
      "appId": "jp.pokemon.pokemontcgp"
    },
    {
      "rank": 92,
      "appId": "com.animal.hunter.shooting.apex"
    },
    {
      "rank": 93,
      "appId": "com.oakever.gemcoloring"
    },
    {
      "rank": 94,
      "appId": "com.griffin.colorblock.games.free.android"
    },
    {
      "rank": 95,
      "appId": "ball.sort.puzzle.color.sorting.bubble.games"
    },
    {
      "rank": 96,
      "appId": "com.chess"
    },
    {
      "rank": 97,
      "appId": "com.screenshake.dominodreams"
    },
    {
      "rank": 98,
      "appId": "com.liteorange.hometopia"
    },
    {
      "rank": 99,
      "appId": "com.gof.global"
    },
    {
      "rank": 100,
      "appId": "com.sniper.shoot.hide.game"
    }
  ]
}
